{
  "$schema": "https://json-schema.org/draft/2020-12/schema",
  "$id": "https://wdeck.local/schema/deck.schema.json",
  "title": "Wdeck deck configuration",
  "description": "Schema di riferimento per deck.json. La validazione a runtime e' implementata in src/host/config/schema.mjs (che aggiunge anche controlli semantici: id univoci, celle non sovrapposte, target di navigazione esistenti).",
  "type": "object",
  "required": ["version", "profiles"],
  "properties": {
    "$schema": { "type": "string" },
    "version": { "type": "integer", "const": 1 },
    "name": { "type": "string", "maxLength": 64 },
    "defaultProfile": { "$ref": "#/$defs/slug" },
    "settings": { "$ref": "#/$defs/settings" },
    "profiles": {
      "type": "array",
      "minItems": 1,
      "items": { "$ref": "#/$defs/profile" }
    }
  },
  "$defs": {
    "slug": { "type": "string", "pattern": "^[a-z0-9][a-z0-9_-]{0,31}$" },
    "hexColor": { "type": "string", "pattern": "^#(?:[0-9a-fA-F]{3}|[0-9a-fA-F]{6})$" },
    "settings": {
      "type": "object",
      "properties": {
        "server": {
          "type": "object",
          "properties": {
            "host": { "type": "string", "description": "0.0.0.0 per esporre in LAN, 127.0.0.1 per solo locale" },
            "port": { "type": "integer", "minimum": 1, "maximum": 65535 },
            "publicName": { "type": "string", "maxLength": 64 }
          }
        },
        "security": {
          "type": "object",
          "properties": {
            "requireToken": { "type": "boolean" },
            "token": { "type": "string", "minLength": 8 },
            "pin": { "type": "string", "pattern": "^[0-9]{4,12}$" },
            "dryRun": { "type": "boolean" },
            "allowUrlSchemes": { "type": "array", "items": { "type": "string" } },
            "allowedExtensions": { "type": "array", "items": { "type": "string", "pattern": "^\\.[a-z0-9]+$" } },
            "allowExec": {
              "type": "array",
              "items": { "type": "string" },
              "description": "Percorsi o pattern glob consentiti per launch/script. Vuoto = tutto bloccato."
            },
            "maxSequenceSteps": { "type": "integer", "minimum": 1, "maximum": 256 }
          }
        },
        "ui": {
          "type": "object",
          "properties": {
            "theme": { "enum": ["dark", "light", "auto"] },
            "accent": { "$ref": "#/$defs/hexColor" },
            "showLabels": { "type": "boolean" }
          }
        }
      }
    },
    "profile": {
      "type": "object",
      "required": ["id", "pages"],
      "properties": {
        "id": { "$ref": "#/$defs/slug" },
        "name": { "type": "string", "maxLength": 64 },
        "defaultPage": { "$ref": "#/$defs/slug" },
        "pages": { "type": "array", "minItems": 1, "items": { "$ref": "#/$defs/page" } }
      }
    },
    "page": {
      "type": "object",
      "required": ["id", "rows", "cols", "buttons"],
      "properties": {
        "id": { "$ref": "#/$defs/slug" },
        "name": { "type": "string", "maxLength": 64 },
        "rows": { "type": "integer", "minimum": 1, "maximum": 8 },
        "cols": { "type": "integer", "minimum": 1, "maximum": 12 },
        "source": {
          "enum": ["windows", "apps", "widgets"],
          "description": "Pagina dinamica: i tile arrivano dall'host (finestre aperte, app del menu Start, widget di stato) invece che da 'buttons'."
        },
        "groups": {
          "type": "array",
          "maxItems": 24,
          "description": "Gruppi visivi per la pagina: danno a un insieme di tile una label e un colore comuni.",
          "items": { "$ref": "#/$defs/group" }
        },
        "buttons": { "type": "array", "maxItems": 96, "items": { "$ref": "#/$defs/button" } }
      }
    },
    "group": {
      "type": "object",
      "required": ["id", "label", "color"],
      "properties": {
        "id": { "$ref": "#/$defs/slug", "description": "univoco nella pagina" },
        "label": { "type": "string", "maxLength": 32 },
        "color": { "$ref": "#/$defs/hexColor" }
      }
    },
    "button": {
      "type": "object",
      "required": ["id", "row", "col", "action"],
      "properties": {
        "id": { "$ref": "#/$defs/slug", "description": "univoco nell'intero deck" },
        "label": { "type": "string", "maxLength": 48 },
        "row": { "type": "integer", "minimum": 0, "maximum": 7 },
        "col": { "type": "integer", "minimum": 0, "maximum": 11 },
        "icon": { "type": "string", "pattern": "^([a-z0-9][a-z0-9-]{0,23}|custom:[a-z0-9][a-z0-9-]{0,31}|emoji:[^ \"'<>&]{1,16})$" },
        "color": { "$ref": "#/$defs/hexColor" },
        "textColor": { "$ref": "#/$defs/hexColor" },
        "group": { "$ref": "#/$defs/slug", "description": "id di un gruppo definito nella stessa pagina" },
        "action": { "$ref": "#/$defs/action" },
        "holdAction": { "$ref": "#/$defs/action" },
        "releaseAction": { "$ref": "#/$defs/action", "description": "azione al rilascio: rende il bottone momentaneo (action alla pressione, releaseAction al rilascio)" },
        "kind": {
          "type": "string",
          "enum": ["button", "folder", "macro", "timer", "pad", "selector", "slider", "xy", "color", "encoder", "jog", "stepper", "gauge", "meter", "chart", "display"],
          "description": "come si comanda. gauge/meter/chart/display sono di sola lettura e rifiutano le pressioni"
        },
        "span": { "type": "integer", "minimum": 1, "maximum": 12, "description": "celle occupate in orizzontale; assente vale 2 per slider/xy/pad/chart, 1 per il resto" },
        "confirm": { "type": "boolean" },
        "status": { "type": "boolean", "description": "assente vale true: legge lo stato reale dall'host" },
        "min": { "type": "number", "description": "slider, encoder, stepper" },
        "max": { "type": "number", "description": "slider, encoder, stepper" },
        "step": { "type": "number", "exclusiveMinimum": 0, "description": "slider, encoder, stepper; ammette i decimali (0.5 gradi)" },
        "orientation": { "type": "string", "enum": ["h", "v"], "description": "solo slider" },
        "center": { "type": "boolean", "description": "solo slider: parte dal centro (bilanciamento)" },
        "options": { "type": "array", "minItems": 2, "maxItems": 8, "items": { "type": "string", "maxLength": 24 }, "description": "solo selector" },
        "rows": { "type": "integer", "minimum": 1, "maximum": 8, "description": "solo pad" },
        "cols": { "type": "integer", "minimum": 1, "maximum": 8, "description": "solo pad" },
        "seconds": { "type": "integer", "minimum": 1, "maximum": 86400, "description": "solo timer" },
        "mode": { "type": "string", "enum": ["kelvin", "rgb"], "description": "solo color" }
      }
    },
    "action": {
      "type": "object",
      "required": ["type"],
      "properties": {
        "type": {
          "type": "string",
          "description": "Tipo registrato nel registro azioni dell'host",
          "examples": ["launch", "url", "media", "hotkey", "text", "script", "sequence", "delay", "http", "navigate", "noop", "stub"]
        },
        "params": { "type": "object" }
      }
    }
  }
}
